{"base":"1111111111111111111111111111111111111111","conflict_reason":null,"context_digest":"6547f58b6b9fc9819f105a248a544bc13905dd8a746074070ecb26fe1f275745","description":"Local PR narrative. Not proof of behavior.","enters_canonical_computation":false,"head":"abcdef1234567890abcdef1234567890abcdef12","labels":["architecture"],"linked_references":["LOCAL-123"],"narrative_only":true,"provenance":"local_file","revision_agreement":"agrees","schema_name":"codestrata.supplied-pr-context.v1","schema_version":"1.0.0","supplied_path":"./pr-context.json","title":"Tighten module imports"}
